{
  "$schema": "http://json-schema.org/draft-07/schema#",
  "title": "TelemetryReport",
  "type": "object",
  "required": ["report_id", "generated_at", "summary"],
  "properties": {
    "report_id": { "type": "string" },
    "generated_at": { "type": "string", "format": "date-time" },
    "summary": { "type": "string" },
    "findings": {
      "type": "array",
      "items": {
        "type": "object",
        "required": ["title", "detail"],
        "properties": {
          "title": { "type": "string" },
          "detail": { "type": "string" },
          "severity": { "type": "string" }
        }
      }
    }
  }
}
